{
  "schemaType": "nansen.pipeline",
  "schemaVersion": "0.1.0",
  "id": "ophys.preprocess",
  "version": "1.0.0",
  "title": "Two-photon preprocessing",
  "description": "Correct motion, compute image statistics, detect ROIs, extract their signals, compute ΔF/F and deconvolve.",
  "entityType": "*",
  "steps": [
    {
      "method": "ophys.motion_correction",
      "title": "Correct motion"
    },
    {
      "method": "ophys.image_stats",
      "title": "Image statistics"
    },
    {
      "method": "ophys.detect_rois",
      "title": "Detect ROIs"
    },
    {
      "method": "ophys.extract_signals",
      "title": "Extract signals"
    },
    {
      "method": "ophys.compute_dff",
      "title": "Compute ΔF/F"
    },
    {
      "method": "ophys.deconvolve",
      "title": "Deconvolve"
    }
  ]
}
